{"diagnostics":[{"evidence":[{"label":"condition","value":"err != nil"},{"label":"branch_fingerprint","value":"59289caa933edad6"}],"file":"authorize.go","fix":null,"help":"This is a repo-local heuristic: it checks nearby extracted test facts, not exact coverage.","labels":[],"message":"Add a companion test for this Go error branch.","range":{"end_col":15,"end_line":8,"start_col":5,"start_line":8},"rule_id":"local/require-error-branch-tests","severity":"warn","stable_fingerprint":"aa8bb8d70334ca3e","suggestions":[]}],"schema":"https://raw.githubusercontent.com/oaiz-io/polint/main/docs/schemas/polint-report-v1.json","summary":{"budgets":[],"providers":[{"cache":{"hits":0,"misses":0,"recomputes":1,"writes":0},"provider_id":"polint.go.syntax","status":"succeeded"},{"cache":{"hits":0,"misses":0,"recomputes":0,"writes":0},"provider_id":"polint.metrics","status":"succeeded"},{"cache":{"hits":0,"misses":0,"recomputes":0,"writes":0},"provider_id":"polint.module_graph","status":"succeeded"},{"cache":{"hits":0,"misses":0,"recomputes":0,"writes":0},"provider_id":"polint.symbol_graph","status":"succeeded"},{"cache":{"hits":0,"misses":0,"recomputes":0,"writes":0},"provider_id":"polint.ts.syntax","status":"succeeded"}],"rules":[{"capabilities_ok":true,"diagnostics_emitted":1,"files_in_scope":1,"observed_events":0,"outcome":"analyzed","planned":true,"rule_id":"local/require-error-branch-tests"}]},"tool":{"name":"polint","version":"<stripped>"},"version":2}
