{"diagnostics":[{"evidence":[{"label":"literal","value":"#ff00aa"},{"label":"source","value":"jsx-attribute"}],"file":"Button.tsx","fix":null,"help":"Move this value to a theme/design-token file or use an existing token.","labels":[],"message":"Raw color literal `#ff00aa` should use a design token.","range":{"end_col":38,"end_line":6,"start_col":18,"start_line":6},"rule_id":"local/no-raw-colors","severity":"error","stable_fingerprint":"045fbb3f0c7f6401","suggestions":[]},{"evidence":[{"label":"literal","value":"#ff00aa"},{"label":"source","value":"string-literal"}],"file":"Button.tsx","fix":null,"help":"Move this value to a theme/design-token file or use an existing token.","labels":[],"message":"Raw color literal `#ff00aa` should use a design token.","range":{"end_col":38,"end_line":6,"start_col":29,"start_line":6},"rule_id":"local/no-raw-colors","severity":"error","stable_fingerprint":"cb86ff4f9aae8879","suggestions":[]}],"schema":"https://raw.githubusercontent.com/oaiz-io/polint/main/docs/schemas/polint-report-v1.json","summary":{"budgets":[],"providers":[{"cache":{"hits":0,"misses":0,"recomputes":0,"writes":0},"provider_id":"polint.abstract_domains","reason":"NotSelected","stage":"Planning","status":"planned_absent"},{"cache":{"hits":0,"misses":0,"recomputes":0,"writes":0},"provider_id":"polint.calls","reason":"NotSelected","stage":"Planning","status":"planned_absent"},{"cache":{"hits":0,"misses":0,"recomputes":0,"writes":0},"provider_id":"polint.cfg","reason":"NotSelected","stage":"Planning","status":"planned_absent"},{"cache":{"hits":0,"misses":0,"recomputes":0,"writes":0},"provider_id":"polint.data_flow","reason":"NotSelected","stage":"Planning","status":"planned_absent"},{"cache":{"hits":0,"misses":0,"recomputes":0,"writes":0},"provider_id":"polint.direct_summaries","reason":"NotSelected","stage":"Planning","status":"planned_absent"},{"cache":{"hits":0,"misses":0,"recomputes":0,"writes":0},"provider_id":"polint.entrypoints","reason":"NotSelected","stage":"Planning","status":"planned_absent"},{"cache":{"hits":0,"misses":0,"recomputes":0,"writes":0},"provider_id":"polint.evidence","reason":"NotSelected","stage":"Planning","status":"planned_absent"},{"cache":{"hits":0,"misses":0,"recomputes":0,"writes":0},"provider_id":"polint.extensions","reason":"NotSelected","stage":"Planning","status":"planned_absent"},{"cache":{"hits":0,"misses":0,"recomputes":0,"writes":0},"provider_id":"polint.go.semantic","reason":"NotSelected","stage":"Planning","status":"planned_absent"},{"cache":{"hits":0,"misses":0,"recomputes":0,"writes":0},"provider_id":"polint.go.syntax","status":"succeeded"},{"cache":{"hits":0,"misses":0,"recomputes":0,"writes":0},"provider_id":"polint.identity","reason":"NotSelected","stage":"Planning","status":"planned_absent"},{"cache":{"hits":0,"misses":0,"recomputes":0,"writes":0},"provider_id":"polint.metrics","status":"succeeded"},{"cache":{"hits":0,"misses":0,"recomputes":0,"writes":0},"provider_id":"polint.module_graph","status":"succeeded"},{"cache":{"hits":0,"misses":0,"recomputes":0,"writes":0},"provider_id":"polint.module_topology","reason":"NotSelected","stage":"Planning","status":"planned_absent"},{"cache":{"hits":0,"misses":0,"recomputes":0,"writes":0},"provider_id":"polint.reachability","reason":"NotSelected","stage":"Planning","status":"planned_absent"},{"cache":{"hits":0,"misses":0,"recomputes":0,"writes":0},"provider_id":"polint.refined_calls","reason":"NotSelected","stage":"Planning","status":"planned_absent"},{"cache":{"hits":0,"misses":0,"recomputes":0,"writes":0},"provider_id":"polint.semantic_graph","reason":"NotSelected","stage":"Planning","status":"planned_absent"},{"cache":{"hits":0,"misses":0,"recomputes":0,"writes":0},"provider_id":"polint.semantic_mir","reason":"NotSelected","stage":"Planning","status":"planned_absent"},{"cache":{"hits":0,"misses":0,"recomputes":0,"writes":0},"provider_id":"polint.solver","reason":"NotSelected","stage":"Planning","status":"planned_absent"},{"cache":{"hits":0,"misses":0,"recomputes":0,"writes":0},"provider_id":"polint.source","status":"succeeded"},{"cache":{"hits":0,"misses":0,"recomputes":0,"writes":0},"provider_id":"polint.symbol_graph","status":"succeeded"},{"cache":{"hits":0,"misses":0,"recomputes":1,"writes":0},"provider_id":"polint.ts.syntax","status":"succeeded"},{"cache":{"hits":0,"misses":0,"recomputes":0,"writes":0},"provider_id":"polint.type_value_alias","reason":"NotSelected","stage":"Planning","status":"planned_absent"}],"rules":[{"capabilities_ok":true,"diagnostics_emitted":2,"files_in_scope":1,"observed_events":0,"outcome":"analyzed","planned":true,"rule_id":"local/no-raw-colors"}]},"tool":{"name":"polint","version":"<stripped>"},"version":2}
