{"diagnostics":[{"evidence":[{"label":"function","value":"Route"},{"label":"complexity","value":"3"}],"file":"router.go","fix":null,"help":"Split deeply branched behavior into smaller focused functions.","labels":[],"message":"Go function `Route` has cyclomatic complexity 3, max 1.","range":{"end_col":2,"end_line":17,"start_col":1,"start_line":7},"rule_id":"local/go-cyclomatic-complexity","severity":"warn","stable_fingerprint":"0a2314fead7c1884","suggestions":[]}],"schema":"https://raw.githubusercontent.com/oaiz-io/polint/main/docs/schemas/polint-report-v1.json","summary":{"budgets":[],"providers":[{"cache":{"hits":0,"misses":0,"recomputes":0,"writes":0},"provider_id":"polint.abstract_domains","reason":"NotSelected","stage":"Planning","status":"planned_absent"},{"cache":{"hits":0,"misses":0,"recomputes":0,"writes":0},"provider_id":"polint.calls","reason":"NotSelected","stage":"Planning","status":"planned_absent"},{"cache":{"hits":0,"misses":0,"recomputes":0,"writes":0},"provider_id":"polint.cfg","reason":"NotSelected","stage":"Planning","status":"planned_absent"},{"cache":{"hits":0,"misses":0,"recomputes":0,"writes":0},"provider_id":"polint.data_flow","reason":"NotSelected","stage":"Planning","status":"planned_absent"},{"cache":{"hits":0,"misses":0,"recomputes":0,"writes":0},"provider_id":"polint.direct_summaries","reason":"NotSelected","stage":"Planning","status":"planned_absent"},{"cache":{"hits":0,"misses":0,"recomputes":0,"writes":0},"provider_id":"polint.entrypoints","reason":"NotSelected","stage":"Planning","status":"planned_absent"},{"cache":{"hits":0,"misses":0,"recomputes":0,"writes":0},"provider_id":"polint.evidence","reason":"NotSelected","stage":"Planning","status":"planned_absent"},{"cache":{"hits":0,"misses":0,"recomputes":0,"writes":0},"provider_id":"polint.extensions","reason":"NotSelected","stage":"Planning","status":"planned_absent"},{"cache":{"hits":0,"misses":0,"recomputes":0,"writes":0},"provider_id":"polint.go.semantic","reason":"NotSelected","stage":"Planning","status":"planned_absent"},{"cache":{"hits":0,"misses":0,"recomputes":1,"writes":0},"provider_id":"polint.go.syntax","status":"succeeded"},{"cache":{"hits":0,"misses":0,"recomputes":0,"writes":0},"provider_id":"polint.identity","reason":"NotSelected","stage":"Planning","status":"planned_absent"},{"cache":{"hits":0,"misses":0,"recomputes":0,"writes":0},"provider_id":"polint.metrics","status":"succeeded"},{"cache":{"hits":0,"misses":0,"recomputes":0,"writes":0},"provider_id":"polint.module_graph","status":"succeeded"},{"cache":{"hits":0,"misses":0,"recomputes":0,"writes":0},"provider_id":"polint.module_topology","reason":"NotSelected","stage":"Planning","status":"planned_absent"},{"cache":{"hits":0,"misses":0,"recomputes":0,"writes":0},"provider_id":"polint.reachability","reason":"NotSelected","stage":"Planning","status":"planned_absent"},{"cache":{"hits":0,"misses":0,"recomputes":0,"writes":0},"provider_id":"polint.refined_calls","reason":"NotSelected","stage":"Planning","status":"planned_absent"},{"cache":{"hits":0,"misses":0,"recomputes":0,"writes":0},"provider_id":"polint.semantic_graph","reason":"NotSelected","stage":"Planning","status":"planned_absent"},{"cache":{"hits":0,"misses":0,"recomputes":0,"writes":0},"provider_id":"polint.semantic_mir","reason":"NotSelected","stage":"Planning","status":"planned_absent"},{"cache":{"hits":0,"misses":0,"recomputes":0,"writes":0},"provider_id":"polint.solver","reason":"NotSelected","stage":"Planning","status":"planned_absent"},{"cache":{"hits":0,"misses":0,"recomputes":0,"writes":0},"provider_id":"polint.source","status":"succeeded"},{"cache":{"hits":0,"misses":0,"recomputes":0,"writes":0},"provider_id":"polint.symbol_graph","status":"succeeded"},{"cache":{"hits":0,"misses":0,"recomputes":0,"writes":0},"provider_id":"polint.ts.syntax","status":"succeeded"},{"cache":{"hits":0,"misses":0,"recomputes":0,"writes":0},"provider_id":"polint.type_value_alias","reason":"NotSelected","stage":"Planning","status":"planned_absent"}],"rules":[{"capabilities_ok":true,"diagnostics_emitted":1,"files_in_scope":1,"observed_events":0,"outcome":"analyzed","planned":true,"rule_id":"local/go-cyclomatic-complexity"}]},"tool":{"name":"polint","version":"<stripped>"},"version":2}
