{"diagnostics":[{"evidence":[{"label":"condition","value":"err != nil"},{"label":"edge","value":"true"},{"label":"branch_fingerprint","value":"28358c4b5a7f4ffb"}],"file":"authorize.go","fix":null,"help":"Add a test case that exercises this branch. This rule is heuristic and does not prove exact coverage.","labels":[],"message":"No nearby test evidence found for Go branch `err != nil`.","range":{"end_col":37,"end_line":12,"start_col":27,"start_line":12},"rule_id":"local/go-branch-obligations","severity":"warn","stable_fingerprint":"1f2b436cc58c43ed","suggestions":[]},{"evidence":[{"label":"condition","value":"err != nil"},{"label":"edge","value":"true"},{"label":"branch_fingerprint","value":"7e1d7e6ee01c0c48"}],"file":"authorize.go","fix":null,"help":"Add a test case that exercises this branch. This rule is heuristic and does not prove exact coverage.","labels":[],"message":"No nearby test evidence found for Go branch `err != nil`.","range":{"end_col":38,"end_line":16,"start_col":28,"start_line":16},"rule_id":"local/go-branch-obligations","severity":"warn","stable_fingerprint":"cf8fc31d71d13be1","suggestions":[]},{"evidence":[{"label":"condition","value":"amount <= 0"},{"label":"edge","value":"true"},{"label":"branch_fingerprint","value":"4b4518b23300ff7d"}],"file":"authorize.go","fix":null,"help":"Add a test case that exercises this branch. This rule is heuristic and does not prove exact coverage.","labels":[],"message":"No nearby test evidence found for Go branch `amount <= 0`.","range":{"end_col":16,"end_line":8,"start_col":5,"start_line":8},"rule_id":"local/go-branch-obligations","severity":"warn","stable_fingerprint":"e20e9549bbd6425b","suggestions":[]}],"schema":"https://raw.githubusercontent.com/oaiz-io/polint/main/docs/schemas/polint-report-v1.json","summary":{"budgets":[],"providers":[{"cache":{"hits":0,"misses":0,"recomputes":0,"writes":0},"provider_id":"polint.abstract_domains","reason":"NotSelected","stage":"Planning","status":"planned_absent"},{"cache":{"hits":0,"misses":0,"recomputes":0,"writes":0},"provider_id":"polint.calls","reason":"NotSelected","stage":"Planning","status":"planned_absent"},{"cache":{"hits":0,"misses":0,"recomputes":0,"writes":0},"provider_id":"polint.cfg","reason":"NotSelected","stage":"Planning","status":"planned_absent"},{"cache":{"hits":0,"misses":0,"recomputes":0,"writes":0},"provider_id":"polint.data_flow","reason":"NotSelected","stage":"Planning","status":"planned_absent"},{"cache":{"hits":0,"misses":0,"recomputes":0,"writes":0},"provider_id":"polint.direct_summaries","reason":"NotSelected","stage":"Planning","status":"planned_absent"},{"cache":{"hits":0,"misses":0,"recomputes":0,"writes":0},"provider_id":"polint.entrypoints","reason":"NotSelected","stage":"Planning","status":"planned_absent"},{"cache":{"hits":0,"misses":0,"recomputes":0,"writes":0},"provider_id":"polint.evidence","reason":"NotSelected","stage":"Planning","status":"planned_absent"},{"cache":{"hits":0,"misses":0,"recomputes":0,"writes":0},"provider_id":"polint.extensions","reason":"NotSelected","stage":"Planning","status":"planned_absent"},{"cache":{"hits":0,"misses":0,"recomputes":0,"writes":0},"provider_id":"polint.go.semantic","reason":"NotSelected","stage":"Planning","status":"planned_absent"},{"cache":{"hits":0,"misses":0,"recomputes":1,"writes":0},"provider_id":"polint.go.syntax","status":"succeeded"},{"cache":{"hits":0,"misses":0,"recomputes":0,"writes":0},"provider_id":"polint.identity","reason":"NotSelected","stage":"Planning","status":"planned_absent"},{"cache":{"hits":0,"misses":0,"recomputes":0,"writes":0},"provider_id":"polint.metrics","status":"succeeded"},{"cache":{"hits":0,"misses":0,"recomputes":0,"writes":0},"provider_id":"polint.module_graph","status":"succeeded"},{"cache":{"hits":0,"misses":0,"recomputes":0,"writes":0},"provider_id":"polint.module_topology","reason":"NotSelected","stage":"Planning","status":"planned_absent"},{"cache":{"hits":0,"misses":0,"recomputes":0,"writes":0},"provider_id":"polint.reachability","reason":"NotSelected","stage":"Planning","status":"planned_absent"},{"cache":{"hits":0,"misses":0,"recomputes":0,"writes":0},"provider_id":"polint.refined_calls","reason":"NotSelected","stage":"Planning","status":"planned_absent"},{"cache":{"hits":0,"misses":0,"recomputes":0,"writes":0},"provider_id":"polint.semantic_graph","reason":"NotSelected","stage":"Planning","status":"planned_absent"},{"cache":{"hits":0,"misses":0,"recomputes":0,"writes":0},"provider_id":"polint.semantic_mir","reason":"NotSelected","stage":"Planning","status":"planned_absent"},{"cache":{"hits":0,"misses":0,"recomputes":0,"writes":0},"provider_id":"polint.solver","reason":"NotSelected","stage":"Planning","status":"planned_absent"},{"cache":{"hits":0,"misses":0,"recomputes":0,"writes":0},"provider_id":"polint.source","status":"succeeded"},{"cache":{"hits":0,"misses":0,"recomputes":0,"writes":0},"provider_id":"polint.symbol_graph","status":"succeeded"},{"cache":{"hits":0,"misses":0,"recomputes":0,"writes":0},"provider_id":"polint.ts.syntax","status":"succeeded"},{"cache":{"hits":0,"misses":0,"recomputes":0,"writes":0},"provider_id":"polint.type_value_alias","reason":"NotSelected","stage":"Planning","status":"planned_absent"}],"rules":[{"capabilities_ok":true,"diagnostics_emitted":3,"files_in_scope":1,"observed_events":0,"outcome":"analyzed","planned":true,"rule_id":"local/go-branch-obligations"}]},"tool":{"name":"polint","version":"<stripped>"},"version":2}
