{"diagnostics":[{"evidence":[{"label":"literal","value":"legacy-testid"},{"label":"matched","value":"legacy-testid"}],"file":"app.ts","fix":null,"help":"Replace the literal or add a narrow, reasoned ignore.","labels":[],"message":"Configured denied literal `legacy-testid` found.","range":{"end_col":43,"end_line":6,"start_col":28,"start_line":6},"rule_id":"local/no-denied-literals","severity":"warn","stable_fingerprint":"f95ca95afc2b520e","suggestions":[]}],"schema":"https://raw.githubusercontent.com/oaiz-io/polint/main/docs/schemas/polint-report-v1.json","summary":{"budgets":[],"providers":[{"cache":{"hits":0,"misses":0,"recomputes":0,"writes":0},"provider_id":"polint.abstract_domains","reason":"NotSelected","stage":"Planning","status":"planned_absent"},{"cache":{"hits":0,"misses":0,"recomputes":0,"writes":0},"provider_id":"polint.calls","reason":"NotSelected","stage":"Planning","status":"planned_absent"},{"cache":{"hits":0,"misses":0,"recomputes":0,"writes":0},"provider_id":"polint.cfg","reason":"NotSelected","stage":"Planning","status":"planned_absent"},{"cache":{"hits":0,"misses":0,"recomputes":0,"writes":0},"provider_id":"polint.data_flow","reason":"NotSelected","stage":"Planning","status":"planned_absent"},{"cache":{"hits":0,"misses":0,"recomputes":0,"writes":0},"provider_id":"polint.direct_summaries","reason":"NotSelected","stage":"Planning","status":"planned_absent"},{"cache":{"hits":0,"misses":0,"recomputes":0,"writes":0},"provider_id":"polint.entrypoints","reason":"NotSelected","stage":"Planning","status":"planned_absent"},{"cache":{"hits":0,"misses":0,"recomputes":0,"writes":0},"provider_id":"polint.evidence","reason":"NotSelected","stage":"Planning","status":"planned_absent"},{"cache":{"hits":0,"misses":0,"recomputes":0,"writes":0},"provider_id":"polint.extensions","reason":"NotSelected","stage":"Planning","status":"planned_absent"},{"cache":{"hits":0,"misses":0,"recomputes":0,"writes":0},"provider_id":"polint.go.semantic","reason":"NotSelected","stage":"Planning","status":"planned_absent"},{"cache":{"hits":0,"misses":0,"recomputes":0,"writes":0},"provider_id":"polint.go.syntax","status":"succeeded"},{"cache":{"hits":0,"misses":0,"recomputes":0,"writes":0},"provider_id":"polint.identity","reason":"NotSelected","stage":"Planning","status":"planned_absent"},{"cache":{"hits":0,"misses":0,"recomputes":0,"writes":0},"provider_id":"polint.metrics","status":"succeeded"},{"cache":{"hits":0,"misses":0,"recomputes":0,"writes":0},"provider_id":"polint.module_graph","status":"succeeded"},{"cache":{"hits":0,"misses":0,"recomputes":0,"writes":0},"provider_id":"polint.module_topology","reason":"NotSelected","stage":"Planning","status":"planned_absent"},{"cache":{"hits":0,"misses":0,"recomputes":0,"writes":0},"provider_id":"polint.reachability","reason":"NotSelected","stage":"Planning","status":"planned_absent"},{"cache":{"hits":0,"misses":0,"recomputes":0,"writes":0},"provider_id":"polint.refined_calls","reason":"NotSelected","stage":"Planning","status":"planned_absent"},{"cache":{"hits":0,"misses":0,"recomputes":0,"writes":0},"provider_id":"polint.semantic_graph","reason":"NotSelected","stage":"Planning","status":"planned_absent"},{"cache":{"hits":0,"misses":0,"recomputes":0,"writes":0},"provider_id":"polint.semantic_mir","reason":"NotSelected","stage":"Planning","status":"planned_absent"},{"cache":{"hits":0,"misses":0,"recomputes":0,"writes":0},"provider_id":"polint.solver","reason":"NotSelected","stage":"Planning","status":"planned_absent"},{"cache":{"hits":0,"misses":0,"recomputes":0,"writes":0},"provider_id":"polint.source","status":"succeeded"},{"cache":{"hits":0,"misses":0,"recomputes":0,"writes":0},"provider_id":"polint.symbol_graph","status":"succeeded"},{"cache":{"hits":0,"misses":0,"recomputes":1,"writes":0},"provider_id":"polint.ts.syntax","status":"succeeded"},{"cache":{"hits":0,"misses":0,"recomputes":0,"writes":0},"provider_id":"polint.type_value_alias","reason":"NotSelected","stage":"Planning","status":"planned_absent"}],"rules":[{"capabilities_ok":true,"diagnostics_emitted":2,"files_in_scope":1,"observed_events":0,"outcome":"analyzed","planned":true,"rule_id":"local/no-denied-literals"}]},"tool":{"name":"polint","version":"<stripped>"},"version":2}
