{"diagnostics":[{"evidence":[{"label":"literal","value":"#ff00aa"},{"label":"source","value":"string-literal"}],"file":"Button.tsx","fix":null,"help":"Use a theme token, CSS variable, or design-system color alias.","labels":[],"message":"Raw color literal `#ff00aa` should use a design token.","range":{"end_col":27,"end_line":7,"start_col":18,"start_line":7},"rule_id":"local/no-raw-colors","severity":"error","stable_fingerprint":"23e2f426d645cacf","suggestions":[]},{"evidence":[{"label":"literal","value":"#00ff00"},{"label":"source","value":"string-literal"}],"file":"Button.tsx","fix":null,"help":"Use a theme token, CSS variable, or design-system color alias.","labels":[],"message":"Raw color literal `#00ff00` should use a design token.","range":{"end_col":59,"end_line":11,"start_col":50,"start_line":11},"rule_id":"local/no-raw-colors","severity":"error","stable_fingerprint":"89eb872badd05a70","suggestions":[]}],"schema":"https://raw.githubusercontent.com/oaiz-io/polint/main/docs/schemas/polint-report-v1.json","summary":{"budgets":[],"providers":[{"cache":{"hits":0,"misses":0,"recomputes":0,"writes":0},"provider_id":"polint.go.syntax","status":"succeeded"},{"cache":{"hits":0,"misses":0,"recomputes":0,"writes":0},"provider_id":"polint.metrics","status":"succeeded"},{"cache":{"hits":0,"misses":0,"recomputes":0,"writes":0},"provider_id":"polint.module_graph","status":"succeeded"},{"cache":{"hits":0,"misses":0,"recomputes":0,"writes":0},"provider_id":"polint.symbol_graph","status":"succeeded"},{"cache":{"hits":0,"misses":0,"recomputes":1,"writes":0},"provider_id":"polint.ts.syntax","status":"succeeded"}],"rules":[{"capabilities_ok":true,"diagnostics_emitted":2,"files_in_scope":1,"observed_events":0,"outcome":"analyzed","planned":true,"rule_id":"local/no-raw-colors"}]},"tool":{"name":"polint","version":"<stripped>"},"version":2}
