{"diagnostics":[{"evidence":[{"label":"test","value":"TestAuthorize"},{"label":"assertions","value":"0"},{"label":"evidence_terms","value":""}],"file":"payment_test.go","fix":null,"help":"Add an explicit assertion, error check, or failure path. This rule is heuristic.","labels":[],"message":"Go test `TestAuthorize` has no obvious assertion or error check.","range":{"end_col":2,"end_line":12,"start_col":1,"start_line":9},"rule_id":"local/go-test-quality","severity":"warn","stable_fingerprint":"683c7b7997a0857d","suggestions":[]},{"evidence":[{"label":"score","value":"1"},{"label":"subtests","value":"0"},{"label":"table_rows","value":"0"},{"label":"assertions","value":"0"}],"file":"payment_test.go","fix":null,"help":"Split this test into smaller behavior-focused tests. This rule is heuristic.","labels":[],"message":"Go test `TestAuthorize` has heuristic maintainability score 1, max 0.","range":{"end_col":2,"end_line":12,"start_col":1,"start_line":9},"rule_id":"local/go-test-quality","severity":"warn","stable_fingerprint":"f485cf8a9ea3ee8c","suggestions":[]}],"schema":"https://raw.githubusercontent.com/oaiz-io/polint/main/docs/schemas/polint-report-v1.json","summary":{"budgets":[],"providers":[{"cache":{"hits":0,"misses":0,"recomputes":1,"writes":0},"provider_id":"polint.go.syntax","status":"succeeded"},{"cache":{"hits":0,"misses":0,"recomputes":0,"writes":0},"provider_id":"polint.metrics","status":"succeeded"},{"cache":{"hits":0,"misses":0,"recomputes":0,"writes":0},"provider_id":"polint.module_graph","status":"succeeded"},{"cache":{"hits":0,"misses":0,"recomputes":0,"writes":0},"provider_id":"polint.symbol_graph","status":"succeeded"},{"cache":{"hits":0,"misses":0,"recomputes":0,"writes":0},"provider_id":"polint.ts.syntax","status":"succeeded"}],"rules":[{"capabilities_ok":true,"diagnostics_emitted":2,"files_in_scope":1,"observed_events":0,"outcome":"analyzed","planned":true,"rule_id":"local/go-test-quality"}]},"tool":{"name":"polint","version":"<stripped>"},"version":2}
