{"diagnostics":[{"evidence":[{"label":"literal","value":"legacy-testid"},{"label":"matched","value":"legacy-testid"}],"file":"query.ts","fix":null,"help":"Replace the literal with an allowed constant or local abstraction.","labels":[],"message":"Configured denied literal `legacy-testid` found.","range":{"end_col":40,"end_line":4,"start_col":25,"start_line":4},"rule_id":"local/no-denied-literals","severity":"error","stable_fingerprint":"e337fbb73d44b2b7","suggestions":[]}],"schema":"https://raw.githubusercontent.com/oaiz-io/polint/main/docs/schemas/polint-report-v1.json","summary":{"budgets":[],"providers":[{"provider_id":"polint.go.syntax","status":"succeeded"},{"provider_id":"polint.metrics","status":"succeeded"},{"provider_id":"polint.module_graph","status":"succeeded"},{"provider_id":"polint.symbol_graph","status":"succeeded"},{"provider_id":"polint.ts.syntax","status":"succeeded"}],"rules":[{"capabilities_ok":true,"diagnostics_emitted":1,"files_in_scope":1,"observed_events":0,"outcome":"analyzed","planned":true,"rule_id":"local/no-denied-literals"}]},"tool":{"name":"polint","version":"<stripped>"},"version":2}
