{"diagnostics":[{"evidence":[{"label":"lines","value":"14"},{"label":"functions","value":"1"}],"file":"service.go","fix":null,"help":null,"labels":[],"message":"File has 14 lines, above the configured maximum of 8.","range":{"end_col":1,"end_line":1,"start_col":1,"start_line":1},"rule_id":"local/large-file","severity":"warn","stable_fingerprint":"62d400abbaef147a","suggestions":[]},{"evidence":[{"label":"function","value":"Route"},{"label":"lines","value":"12"}],"file":"service.go","fix":null,"help":null,"labels":[],"message":"Function `Route` has 12 lines, above the configured maximum of 6.","range":{"end_col":2,"end_line":14,"start_col":1,"start_line":3},"rule_id":"local/large-function","severity":"warn","stable_fingerprint":"a386a985867912d2","suggestions":[]},{"evidence":[{"label":"lines","value":"12"},{"label":"complexity","value":"4"}],"file":"Panel.tsx","fix":null,"help":"Split the policy decision into smaller named branches.","labels":[],"message":"Function `Panel` is both long and branch-heavy.","range":{"end_col":2,"end_line":12,"start_col":8,"start_line":1},"rule_id":"local/code-quality-score","severity":"warn","stable_fingerprint":"b24655a2bedd2aad","suggestions":[]},{"evidence":[{"label":"lines","value":"12"},{"label":"functions","value":"1"}],"file":"Panel.tsx","fix":null,"help":null,"labels":[],"message":"File has 12 lines, above the configured maximum of 8.","range":{"end_col":1,"end_line":1,"start_col":1,"start_line":1},"rule_id":"local/large-file","severity":"warn","stable_fingerprint":"be6de0f85b7d76fa","suggestions":[]},{"evidence":[{"label":"function","value":"Panel"},{"label":"lines","value":"12"}],"file":"Panel.tsx","fix":null,"help":null,"labels":[],"message":"Function `Panel` has 12 lines, above the configured maximum of 6.","range":{"end_col":2,"end_line":12,"start_col":8,"start_line":1},"rule_id":"local/large-function","severity":"warn","stable_fingerprint":"db330c35487364b2","suggestions":[]},{"evidence":[{"label":"lines","value":"12"},{"label":"complexity","value":"5"}],"file":"service.go","fix":null,"help":"Split the policy decision into smaller named branches.","labels":[],"message":"Function `Route` is both long and branch-heavy.","range":{"end_col":2,"end_line":14,"start_col":1,"start_line":3},"rule_id":"local/code-quality-score","severity":"warn","stable_fingerprint":"fd3be5fd0816b14d","suggestions":[]}],"schema":"https://raw.githubusercontent.com/oaiz-io/polint/main/docs/schemas/polint-report-v1.json","summary":{"budgets":[],"providers":[{"cache":{"hits":0,"misses":0,"recomputes":0,"writes":0},"provider_id":"polint.abstract_domains","reason":"NotSelected","stage":"Planning","status":"planned_absent"},{"cache":{"hits":0,"misses":0,"recomputes":0,"writes":0},"provider_id":"polint.calls","reason":"NotSelected","stage":"Planning","status":"planned_absent"},{"cache":{"hits":0,"misses":0,"recomputes":0,"writes":0},"provider_id":"polint.cfg","reason":"NotSelected","stage":"Planning","status":"planned_absent"},{"cache":{"hits":0,"misses":0,"recomputes":0,"writes":0},"provider_id":"polint.data_flow","reason":"NotSelected","stage":"Planning","status":"planned_absent"},{"cache":{"hits":0,"misses":0,"recomputes":0,"writes":0},"provider_id":"polint.direct_summaries","reason":"NotSelected","stage":"Planning","status":"planned_absent"},{"cache":{"hits":0,"misses":0,"recomputes":0,"writes":0},"provider_id":"polint.entrypoints","reason":"NotSelected","stage":"Planning","status":"planned_absent"},{"cache":{"hits":0,"misses":0,"recomputes":0,"writes":0},"provider_id":"polint.evidence","reason":"NotSelected","stage":"Planning","status":"planned_absent"},{"cache":{"hits":0,"misses":0,"recomputes":0,"writes":0},"provider_id":"polint.extensions","reason":"NotSelected","stage":"Planning","status":"planned_absent"},{"cache":{"hits":0,"misses":0,"recomputes":0,"writes":0},"provider_id":"polint.go.semantic","reason":"NotSelected","stage":"Planning","status":"planned_absent"},{"cache":{"hits":0,"misses":0,"recomputes":1,"writes":0},"provider_id":"polint.go.syntax","status":"succeeded"},{"cache":{"hits":0,"misses":0,"recomputes":0,"writes":0},"provider_id":"polint.identity","reason":"NotSelected","stage":"Planning","status":"planned_absent"},{"cache":{"hits":0,"misses":0,"recomputes":1,"writes":0},"provider_id":"polint.metrics","status":"succeeded"},{"cache":{"hits":0,"misses":0,"recomputes":0,"writes":0},"provider_id":"polint.module_graph","status":"succeeded"},{"cache":{"hits":0,"misses":0,"recomputes":0,"writes":0},"provider_id":"polint.module_topology","reason":"NotSelected","stage":"Planning","status":"planned_absent"},{"cache":{"hits":0,"misses":0,"recomputes":0,"writes":0},"provider_id":"polint.reachability","reason":"NotSelected","stage":"Planning","status":"planned_absent"},{"cache":{"hits":0,"misses":0,"recomputes":0,"writes":0},"provider_id":"polint.refined_calls","reason":"NotSelected","stage":"Planning","status":"planned_absent"},{"cache":{"hits":0,"misses":0,"recomputes":0,"writes":0},"provider_id":"polint.semantic_graph","reason":"NotSelected","stage":"Planning","status":"planned_absent"},{"cache":{"hits":0,"misses":0,"recomputes":0,"writes":0},"provider_id":"polint.semantic_mir","reason":"NotSelected","stage":"Planning","status":"planned_absent"},{"cache":{"hits":0,"misses":0,"recomputes":0,"writes":0},"provider_id":"polint.solver","reason":"NotSelected","stage":"Planning","status":"planned_absent"},{"cache":{"hits":0,"misses":0,"recomputes":0,"writes":0},"provider_id":"polint.source","status":"succeeded"},{"cache":{"hits":0,"misses":0,"recomputes":0,"writes":0},"provider_id":"polint.symbol_graph","status":"succeeded"},{"cache":{"hits":0,"misses":0,"recomputes":1,"writes":0},"provider_id":"polint.ts.syntax","status":"succeeded"},{"cache":{"hits":0,"misses":0,"recomputes":0,"writes":0},"provider_id":"polint.type_value_alias","reason":"NotSelected","stage":"Planning","status":"planned_absent"}],"rules":[{"capabilities_ok":true,"diagnostics_emitted":2,"files_in_scope":2,"observed_events":0,"outcome":"analyzed","planned":true,"rule_id":"local/code-quality-score"},{"capabilities_ok":true,"diagnostics_emitted":2,"files_in_scope":2,"observed_events":0,"outcome":"analyzed","planned":true,"rule_id":"local/large-file"},{"capabilities_ok":true,"diagnostics_emitted":2,"files_in_scope":2,"observed_events":0,"outcome":"analyzed","planned":true,"rule_id":"local/large-function"}]},"tool":{"name":"polint","version":"<stripped>"},"version":2}
